<?xml version="1.0" encoding="utf-8"?>
<!DOCTYPE list SYSTEM "armor.dtd">
<list>
	<PhantomSet class_id="8;9;23;24;36;37;48;17;2;127;128;135;129;130" grade="C">
		<helm item_id="2414" /> <!-- Шлем -->
		<chest item_id="398" /> <!-- Верх -->
		<gaiter item_id="418" /> <!-- Низ -->
		<gloves item_id="2455" /> <!-- Перчатки -->
		<boots item_id="2431" /> <!-- Ботинки -->
		<shield item_id="0" /> <!-- щит\сигил -->
	</PhantomSet>
 </list>
